<?xml version='1.0'?>
<!DOCTYPE platform SYSTEM "simgrid.dtd">
<platform version="3">

 <process host="Tremblay" function="node">
  <argument value="4000"/>                           <!-- port on which I am listening -->
  <argument value="Fafard"/><argument value="4000"/> <!-- peer (successor) host id and port-->
  <argument value="--create-token"/>                 <!-- I'm first client, ie I have to create the token -->
 </process>
 
 <process host="Fafard" function="node">
  <argument value="4000"/>                           <!-- port on which I am listening -->
  <argument value="Jupiter"/><argument value="4000"/><!-- peer (successor) host id and port-->
 </process>
 
 <process host="Jupiter" function="node">
  <argument value="4000"/>                            <!-- port on which I am listening -->
  <argument value="Ginette"/><argument value="4000"/> <!-- peer (successor) host id and port-->
 </process>
 
 <process host="Ginette" function="node">
  <argument value="4000"/>                            <!-- port on which I am listening -->
  <argument value="Bourassa"/><argument value="4000"/><!-- peer (successor) host id and port-->
 </process>
 
 <process host="Bourassa" function="node">
  <argument value="4000"/>                            <!-- port on which I am listening -->
  <argument value="Tremblay"/><argument value="4000"/><!-- peer (successor) host id and port-->
 </process>
 
</platform>
