<?xml version='1.0'?>
<!DOCTYPE platform SYSTEM "simgrid.dtd">
<platform version="2">

  <process host="Boucherville" function="master">
      <argument value="100"/>
      <argument value="Boyer"/>
      <argument value="1"/>
  </process>

  <process host="Forget" function="master">
      <argument value="100"/>
      <argument value="Yolande"/>
      <argument value="2"/>
  </process>

  <process host="Boyer" function="slave">
      <argument value="1"/>
  </process>

  <process host="Yolande" function="slave">
      <argument value="2"/>
  </process>

</platform>
