<?xml version='1.0'?>
<!DOCTYPE platform SYSTEM "http://simgrid.gforge.inria.fr/simgrid.dtd">
<platform version="3">
  <process host="alice" function="host">
    <argument value = "c:\Windows\setupact.log"/>
  </process>
  <process host="bob" function="host">
    <argument value = "/scratch/lib/libsimgrid.so.3.6.2"/>
  </process>
  <process host="carl" function="host">
    <argument value = "/scratch/lib/libsimgrid.so.3.6.2"/>
  </process>
  <process host="dave" function="host">
    <argument value = "c:\Windows\bootstat.dat"/>
  </process>
</platform>
