<?xml version='1.0'?>
<!DOCTYPE platform SYSTEM "simgrid.dtd">
<platform version="2">
  <host id="Marc" power="214563000"/>
  <host id="Boivin" power="214563000"/>
  <host id="Emacs" power="214563000"/>
  <host id="Jackson" power="214563000"/>
  <host id="Inc" power="214563000"/>
  <link id="6" bandwidth="1475160.57655719" latency="0.442242015190778" />
  <link id="4" bandwidth="1388512.38295812" latency="0.416265540250451" />
  <link id="1" bandwidth="2248511.50079418" latency="0.674086789664358" />
  <link id="3" bandwidth="1890355.13925945" latency="0.566714213691522" />
  <link id="0" bandwidth="970350.508803584" latency="0.290903764155777" />
  <link id="2" bandwidth="1382762.99083586" latency="0.414541915854115" />
  <link id="5" bandwidth="35925.952527695" latency="0.010770329614269" />
  <route src="Marc" dst="Boivin"><link:ctn id="5"/>  </route>
  <route src="Marc" dst="Emacs"><link:ctn id="4"/>  </route>
  <route src="Marc" dst="Jackson"><link:ctn id="5"/><link:ctn id="6"/>  </route>
  <route src="Marc" dst="Inc"><link:ctn id="5"/><link:ctn id="0"/>  </route>
  <route src="Boivin" dst="Marc"><link:ctn id="5"/>  </route>
  <route src="Boivin" dst="Emacs"><link:ctn id="2"/>  </route>
  <route src="Boivin" dst="Jackson"><link:ctn id="6"/>  </route>
  <route src="Boivin" dst="Inc"><link:ctn id="0"/>  </route>
  <route src="Emacs" dst="Marc"><link:ctn id="4"/>  </route>
  <route src="Emacs" dst="Boivin"><link:ctn id="2"/>  </route>
  <route src="Emacs" dst="Jackson"><link:ctn id="3"/>  </route>
  <route src="Emacs" dst="Inc"><link:ctn id="3"/><link:ctn id="1"/>  </route>
  <route src="Jackson" dst="Marc"><link:ctn id="6"/><link:ctn id="5"/>  </route>
  <route src="Jackson" dst="Boivin"><link:ctn id="6"/>  </route>
  <route src="Jackson" dst="Emacs"><link:ctn id="3"/>  </route>
  <route src="Jackson" dst="Inc"><link:ctn id="1"/>  </route>
  <route src="Inc" dst="Marc"><link:ctn id="0"/><link:ctn id="5"/>  </route>
  <route src="Inc" dst="Boivin"><link:ctn id="0"/>  </route>
  <route src="Inc" dst="Emacs"><link:ctn id="1"/><link:ctn id="3"/>  </route>
  <route src="Inc" dst="Jackson"><link:ctn id="1"/>  </route>
</platform>
