<?xml version='1.0'?>
<!DOCTYPE platform SYSTEM "http://simgrid.gforge.inria.fr/simgrid.dtd">

<!--     This platform does not use any routing. 
         It is what Constant network model expects. -->
	 
<platform version="3">
  <AS id="AS0" routing="None">
    <host id="node-0.acme.org" power="1Gf"/>
    <host id="node-1.acme.org" power="1Gf"/>
    <host id="node-2.acme.org" power="1Gf"/>
    <host id="node-3.acme.org" power="1Gf"/>
    <host id="node-4.acme.org" power="1Gf"/>
    <host id="node-5.acme.org" power="1Gf"/>
    <host id="node-6.acme.org" power="1Gf"/>
    <host id="node-7.acme.org" power="1Gf"/>
    <host id="node-8.acme.org" power="1Gf"/>
    <host id="node-9.acme.org" power="1Gf"/>
  </AS>
</platform>
