<?xml version='1.0'?>
 <!DOCTYPE platform SYSTEM "simgrid.dtd">
 <platform version="2">
 <AS  id="AS0"  routing="Full">
   <!-- ljlkj -->
   <host id="Tremblay" power="1e9"/>
   <host id="Jupiter" power="1e9"/>
   <host id="Fafard" power="1e9"/>
   <host id="Ginette" power="1e9"/>
   <link id="0" bandwidth="1e8" latency="100e-6"/>
   <link id="1" bandwidth="1e8" latency="100e-6"/>
   <link id="2" bandwidth="1e8" latency="100e-6"/>
   <link id="3" bandwidth="1e8" latency="100e-6"/>
   <link id="switch" bandwidth="1e8" latency="100e-6" sharing_policy="FATPIPE"/>
   <link id="loopback" bandwidth="1e10" latency="1e-6" sharing_policy="FATPIPE"/>
   <route src="Tremblay" dst="Tremblay"><link:ctn id="loopback"/></route>
   <route src="Jupiter" dst="Jupiter"><link:ctn id="loopback"/></route>
   <route src="Fafard" dst="Fafard"><link:ctn id="loopback"/></route>
   <route src="Ginette" dst="Ginette"><link:ctn id="loopback"/></route>
   <route src="Tremblay" dst="Jupiter">
     <link:ctn id="0"/><link:ctn id="switch"/><link:ctn id="1"/>
   </route>
   <route src="Tremblay" dst="Fafard">
     <link:ctn id="0"/><link:ctn id="switch"/><link:ctn id="2"/>
   </route>
   <route src="Tremblay" dst="Ginette">
     <link:ctn id="0"/><link:ctn id="switch"/><link:ctn id="3"/>
   </route>
   <route src="Jupiter" dst="Tremblay">
     <link:ctn id="1"/><link:ctn id="switch"/><link:ctn id="0"/>
   </route>
   <route src="Jupiter" dst="Fafard">
     <link:ctn id="1"/><link:ctn id="switch"/><link:ctn id="2"/>
   </route>
   <route src="Jupiter" dst="Ginette">
     <link:ctn id="1"/><link:ctn id="switch"/><link:ctn id="3"/>
   </route>
   <route src="Fafard" dst="Tremblay">
     <link:ctn id="2"/><link:ctn id="switch"/><link:ctn id="0"/>
   </route>
   <route src="Fafard" dst="Jupiter">
     <link:ctn id="2"/><link:ctn id="switch"/><link:ctn id="1"/>
   </route>
   <route src="Fafard" dst="Ginette">
     <link:ctn id="2"/><link:ctn id="switch"/><link:ctn id="3"/>
   </route>
   <route src="Ginette" dst="Tremblay">
     <link:ctn id="3"/><link:ctn id="switch"/><link:ctn id="0"/>
   </route>
   <route src="Ginette" dst="Jupiter">
     <link:ctn id="3"/><link:ctn id="switch"/><link:ctn id="1"/>
   </route>
   <route src="Ginette" dst="Fafard">
     <link:ctn id="3"/><link:ctn id="switch"/><link:ctn id="2"/>
   </route>
 </AS>
 </platform>
